{"assertions":["PTV1-GRAIN-PROMOTION","PTV1-GRAIN-FULFILLMENT","PTV1-GRAIN-RETURNS","PTV1-GRAIN-DATA-QUALITY","PTV1-HEADLINE-SUFFICIENT","PTV1-NO-CROSS-GRAIN-JOIN","PTV1-NO-ATTRIBUTION","PTV1-DECISION-INSUFFICIENT-EVIDENCE"],"contractId":"promotion-trust-v1","dataClassification":"sanitized-synthetic-aggregate","decision":{"reason":"no-common-grain","value":"insufficient-evidence"},"fixtureId":"promotion-trust-small-42-v1","fixtureKind":"tracked-real","inputWindow":{"end":"2026-06-30","scope":"generated-input-domain-not-mart-predicate","start":"2025-07-01"},"integrity":{"algorithm":"sha-256","canonicalization":"rfc8785-jcs-v1","payloadSha256":"19f251845fef14cf43ec4ade1059d0d1090ce54750a5acf2f1c8d781633e6d18"},"limitations":["four independent grains cannot support cross-source attribution","aggregate synthetic evidence only"],"profile":"small","schemaVersion":"promotion-trust-evidence-v1","seed":42,"sources":[{"calculation":"ratio-of-sums","filter":"full-input","grain":["promo_name","channel"],"limitation":"no shared key with fulfillment, returns, or data-quality grains","normalizedRecordsSha256":"a843007695e502eacffa5190156b8c5fe19fe53f3c858b7cdcee680b448579f2","order":["promo_name","channel"],"records":[{"avg_order_value":"848.93","channel":"offline","discount_pct_of_gross":"10.0","gross_revenue":"41503.05","net_revenue":"37352.75","order_count":44,"promo_name":"Back to School","total_discount_amount":"4150.30"},{"avg_order_value":"649.90","channel":"offline","discount_pct_of_gross":"27.0","gross_revenue":"24037.44","net_revenue":"17547.34","order_count":27,"promo_name":"Black Friday","total_discount_amount":"6490.10"},{"avg_order_value":"642.96","channel":"online","discount_pct_of_gross":"27.0","gross_revenue":"7046.12","net_revenue":"5143.65","order_count":8,"promo_name":"Black Friday","total_discount_amount":"1902.47"},{"avg_order_value":"673.98","channel":"online","discount_pct_of_gross":"15.0","gross_revenue":"14272.54","net_revenue":"12131.64","order_count":18,"promo_name":"Holiday Season","total_discount_amount":"2140.90"},{"avg_order_value":"681.18","channel":"online","discount_pct_of_gross":"15.0","gross_revenue":"5609.73","net_revenue":"4768.28","order_count":7,"promo_name":"Summer Clearance","total_discount_amount":"841.45"},{"avg_order_value":"807.83","channel":"offline","discount_pct_of_gross":"0.0","gross_revenue":"502531.87","net_revenue":"502468.07","order_count":622,"promo_name":"no_promotion","total_discount_amount":"63.80"},{"avg_order_value":"891.96","channel":"online","discount_pct_of_gross":"0.0","gross_revenue":"78492.12","net_revenue":"78492.12","order_count":88,"promo_name":"no_promotion","total_discount_amount":"0.00"}],"rowCount":7,"sourceId":"mart_promotion_effectiveness","sourceMartContentSha256":"5b6bc790aaeed2891608b8c1fceba0d4904fd49b9865c160658d6f5249e0bfc0"},{"calculation":"ratio-of-sums; lead time weighted by non-in-transit shipments","filter":"full-input","grain":["carrier","region_name"],"limitation":"no shared key with promotion, returns, or data-quality grains","normalizedRecordsSha256":"b8b0cdfeb888c4bb106503647f6e03373bf1bf8fe2210aa3532dfdddabad7323","order":["carrier","region_name"],"records":[{"avg_lead_time_days":"4.7","carrier":"DHL","in_transit_count":0,"on_time_count":15,"on_time_pct":"88.2","region_name":"East Asia","shipment_count":17},{"avg_lead_time_days":"5.5","carrier":"DHL","in_transit_count":3,"on_time_count":18,"on_time_pct":"75.0","region_name":"Europe","shipment_count":24},{"avg_lead_time_days":"6.2","carrier":"DHL","in_transit_count":3,"on_time_count":36,"on_time_pct":"81.8","region_name":"North America","shipment_count":44},{"avg_lead_time_days":"5.4","carrier":"DHL","in_transit_count":3,"on_time_count":26,"on_time_pct":"81.3","region_name":"Oceania","shipment_count":32},{"avg_lead_time_days":"5.4","carrier":"DHL","in_transit_count":2,"on_time_count":44,"on_time_pct":"86.3","region_name":"Southeast Asia","shipment_count":51},{"avg_lead_time_days":"4.5","carrier":"FedEx","in_transit_count":2,"on_time_count":12,"on_time_pct":"80.0","region_name":"East Asia","shipment_count":15},{"avg_lead_time_days":"3.8","carrier":"FedEx","in_transit_count":0,"on_time_count":13,"on_time_pct":"86.7","region_name":"Europe","shipment_count":15},{"avg_lead_time_days":"5.4","carrier":"FedEx","in_transit_count":6,"on_time_count":50,"on_time_pct":"83.3","region_name":"North America","shipment_count":60},{"avg_lead_time_days":"6.5","carrier":"FedEx","in_transit_count":1,"on_time_count":32,"on_time_pct":"94.1","region_name":"Oceania","shipment_count":34},{"avg_lead_time_days":"5.8","carrier":"FedEx","in_transit_count":2,"on_time_count":49,"on_time_pct":"83.1","region_name":"Southeast Asia","shipment_count":59},{"avg_lead_time_days":"4.3","carrier":"Local Courier","in_transit_count":0,"on_time_count":10,"on_time_pct":"83.3","region_name":"East Asia","shipment_count":12},{"avg_lead_time_days":"5.1","carrier":"Local Courier","in_transit_count":2,"on_time_count":12,"on_time_pct":"85.7","region_name":"Europe","shipment_count":14},{"avg_lead_time_days":"5.6","carrier":"Local Courier","in_transit_count":5,"on_time_count":43,"on_time_pct":"81.1","region_name":"North America","shipment_count":53},{"avg_lead_time_days":"5.4","carrier":"Local Courier","in_transit_count":3,"on_time_count":27,"on_time_pct":"84.4","region_name":"Oceania","shipment_count":32},{"avg_lead_time_days":"5.5","carrier":"Local Courier","in_transit_count":3,"on_time_count":41,"on_time_pct":"87.2","region_name":"Southeast Asia","shipment_count":47},{"avg_lead_time_days":"5.3","carrier":"UPS","in_transit_count":4,"on_time_count":11,"on_time_pct":"68.8","region_name":"East Asia","shipment_count":16},{"avg_lead_time_days":"5.7","carrier":"UPS","in_transit_count":2,"on_time_count":18,"on_time_pct":"78.3","region_name":"Europe","shipment_count":23},{"avg_lead_time_days":"5.3","carrier":"UPS","in_transit_count":3,"on_time_count":37,"on_time_pct":"84.1","region_name":"North America","shipment_count":44},{"avg_lead_time_days":"6.1","carrier":"UPS","in_transit_count":5,"on_time_count":23,"on_time_pct":"67.6","region_name":"Oceania","shipment_count":34},{"avg_lead_time_days":"4.8","carrier":"UPS","in_transit_count":4,"on_time_count":46,"on_time_pct":"85.2","region_name":"Southeast Asia","shipment_count":54},{"avg_lead_time_days":"5.2","carrier":"USPS","in_transit_count":2,"on_time_count":18,"on_time_pct":"78.3","region_name":"East Asia","shipment_count":23},{"avg_lead_time_days":"5.6","carrier":"USPS","in_transit_count":3,"on_time_count":12,"on_time_pct":"63.2","region_name":"Europe","shipment_count":19},{"avg_lead_time_days":"5.7","carrier":"USPS","in_transit_count":6,"on_time_count":43,"on_time_pct":"82.7","region_name":"North America","shipment_count":52},{"avg_lead_time_days":"5.2","carrier":"USPS","in_transit_count":3,"on_time_count":34,"on_time_pct":"82.9","region_name":"Oceania","shipment_count":41},{"avg_lead_time_days":"5.5","carrier":"USPS","in_transit_count":3,"on_time_count":49,"on_time_pct":"89.1","region_name":"Southeast Asia","shipment_count":55}],"rowCount":25,"sourceId":"mart_fulfillment_performance","sourceMartContentSha256":"8c0114d1ab48b4fb42009aba3df192988bf917004461d0c0dd0155d0283dce60"},{"calculation":"ratio-of-sums","filter":"full-input","grain":["reason","category_name","region_name"],"limitation":"no shared key with promotion, fulfillment, or data-quality grains","normalizedRecordsSha256":"e507ba4f5b4f250c8a87b454a376362151be5baf50996681c9efdbd1f5d3cd6a","order":["reason","category_name","region_name"],"records":[{"avg_refund_amount":"171.50","category_name":"Electronics","reason":"changed_mind","region_name":"East Asia","return_count":1,"total_refund_amount":"171.50"},{"avg_refund_amount":"40.96","category_name":"Electronics","reason":"changed_mind","region_name":"North America","return_count":1,"total_refund_amount":"40.96"},{"avg_refund_amount":"100.86","category_name":"Electronics","reason":"changed_mind","region_name":"Southeast Asia","return_count":1,"total_refund_amount":"100.86"},{"avg_refund_amount":"147.73","category_name":"Home & Kitchen","reason":"changed_mind","region_name":"North America","return_count":2,"total_refund_amount":"295.45"},{"avg_refund_amount":"272.39","category_name":"Home & Kitchen","reason":"changed_mind","region_name":"Oceania","return_count":1,"total_refund_amount":"272.39"},{"avg_refund_amount":"8.03","category_name":"Sports & Outdoors","reason":"changed_mind","region_name":"Southeast Asia","return_count":1,"total_refund_amount":"8.03"},{"avg_refund_amount":"8.25","category_name":"Toys & Games","reason":"changed_mind","region_name":"Southeast Asia","return_count":1,"total_refund_amount":"8.25"},{"avg_refund_amount":"954.65","category_name":"Electronics","reason":"defective","region_name":"East Asia","return_count":1,"total_refund_amount":"954.65"},{"avg_refund_amount":"954.65","category_name":"Electronics","reason":"defective","region_name":"Oceania","return_count":1,"total_refund_amount":"954.65"},{"avg_refund_amount":"194.75","category_name":"Footwear","reason":"defective","region_name":"East Asia","return_count":1,"total_refund_amount":"194.75"},{"avg_refund_amount":"114.01","category_name":"Footwear","reason":"defective","region_name":"Oceania","return_count":1,"total_refund_amount":"114.01"},{"avg_refund_amount":"270.10","category_name":"Home & Kitchen","reason":"defective","region_name":"Europe","return_count":1,"total_refund_amount":"270.10"},{"avg_refund_amount":"258.25","category_name":"Home & Kitchen","reason":"defective","region_name":"North America","return_count":1,"total_refund_amount":"258.25"},{"avg_refund_amount":"116.01","category_name":"Toys & Games","reason":"defective","region_name":"Southeast Asia","return_count":1,"total_refund_amount":"116.01"},{"avg_refund_amount":"771.79","category_name":"Electronics","reason":"duplicate_order","region_name":"Europe","return_count":1,"total_refund_amount":"771.79"},{"avg_refund_amount":"277.00","category_name